{
  "schema_name": "EvidenceRecipeV1",
  "schema_version": "1.0.0",
  "record_id": "recipe-synthetic-v1",
  "recipe_id": "synthetic-unforced-error-reel",
  "recipe_digest": {"algorithm": "sha256", "value": "71b773304a2144125ee214cf0520de027ee5e0411956cd589ad25b5da8979330"},
  "plan_id": "synthetic-unforced-error-plan",
  "items": [
    {
      "order": 0,
      "sample_id": "synthetic-match-001",
      "rally_ref": {
        "source_ref": {"artifact_id": "synthetic-match-001", "digest": {"algorithm": "sha256", "value": "cdcdcdcdcdcdcdcdcdcdcdcdcdcdcdcdcdcdcdcdcdcdcdcdcdcdcdcdcdcdcdcd"}},
        "start_frame": 400,
        "end_frame": 610
      },
      "shot_refs": [
        {"start_frame": 520, "end_frame": 550, "provenance": {"authority": "model_observation", "model_id": "synthetic-shot-model", "confidence": 0.82}},
        {"start_frame": 551, "end_frame": 580, "provenance": {"authority": "model_observation", "model_id": "synthetic-shot-model", "confidence": 0.86}},
        {"start_frame": 581, "end_frame": 610, "provenance": {"authority": "model_observation", "model_id": "synthetic-shot-model", "confidence": 0.79}}
      ],
      "outcome_provenance": {"authority": "human_confirmed"}
    }
  ],
  "rendition": "sd30",
  "regenerable_without_perception": true,
  "encoder_identity": "synthetic-encoder"
}
